[
  {
    "scenario_version": "pm.scenario/v1",
    "scenario_id": "github-read-exact-repository",
    "connector_id": "github",
    "lane": "direct_read",
    "operation_id": "issues/list-for-repo",
    "source_refs": [
      {
        "source_id": "github-rest-api-description",
        "pointer": "#/paths/~1repos~1{owner}~1{repo}~1issues/get"
      },
      {
        "source_id": "github-rest-api-description",
        "pointer": "#/paths/~1repos~1{owner}~1{repo}~1issues/get/responses/200/content/application~1json"
      }
    ],
    "requirements": [
      {
        "requirement_id": "service.public-path",
        "kind": "service",
        "value": "pm.client-api-worker.public-path"
      },
      {
        "requirement_id": "secret.pm-connection",
        "kind": "secret_reference",
        "value": "connection/acme-widgets-github-read"
      },
      {
        "requirement_id": "capability.http.execute",
        "kind": "capability",
        "value": "http.execute"
      },
      {
        "requirement_id": "capability.value.serialize",
        "kind": "capability",
        "value": "value.serialize"
      },
      {
        "requirement_id": "capability.effect.authorize",
        "kind": "capability",
        "value": "effect.authorize"
      },
      {
        "requirement_id": "capability.effect.limit",
        "kind": "capability",
        "value": "effect.limit"
      },
      {
        "requirement_id": "capability.http.paginate",
        "kind": "capability",
        "value": "http.paginate"
      },
      {
        "requirement_id": "foundation.http.execute",
        "kind": "foundation",
        "value": "FND-06@1.0.0"
      },
      {
        "requirement_id": "foundation.value.serialize",
        "kind": "foundation",
        "value": "FND-03@1.0.0"
      },
      {
        "requirement_id": "foundation.effect.authorize",
        "kind": "foundation",
        "value": "FND-05@2.0.0"
      },
      {
        "requirement_id": "foundation.effect.limit",
        "kind": "foundation",
        "value": "FND-10@2.0.0"
      },
      {
        "requirement_id": "foundation.http.paginate",
        "kind": "foundation",
        "value": "FND-08@1.0.0"
      },
      {
        "requirement_id": "fixture.github.issues.exact-page",
        "kind": "fixture",
        "value": "fixture.github.issues.exact-page"
      }
    ],
    "steps": [
      {
        "step_id": "read_page_one",
        "kind": "invoke",
        "depends_on": [],
        "action": "issues/list-for-repo",
        "input": {
          "path.owner": "acme",
          "path.repo": "widgets",
          "query.per-page": 2,
          "query.page": 1
        },
        "captures": []
      }
    ],
    "assertions": [
      {
        "assertion_id": "data-is-record-array",
        "step_id": "read_page_one",
        "kind": "equals",
        "pointer": "/data/type",
        "expected": "array"
      },
      {
        "assertion_id": "exact-id",
        "step_id": "read_page_one",
        "kind": "equals",
        "pointer": "/data/elements/0/fields/id",
        "expected": {
          "presence": "value",
          "type": "integer",
          "exact": "9001",
          "precision": 4,
          "scale": 0
        }
      },
      {
        "assertion_id": "exact-number",
        "step_id": "read_page_one",
        "kind": "equals",
        "pointer": "/data/elements/0/fields/number",
        "expected": {
          "presence": "value",
          "type": "integer",
          "exact": "17",
          "precision": 2,
          "scale": 0
        }
      },
      {
        "assertion_id": "exact-repository",
        "step_id": "read_page_one",
        "kind": "equals",
        "pointer": "/data/elements/0/fields/repository_url",
        "expected": {
          "presence": "value",
          "type": "string",
          "text": "https://api.github.com/repos/acme/widgets"
        }
      },
      {
        "assertion_id": "fetched-count",
        "step_id": "read_page_one",
        "kind": "equals",
        "pointer": "/pagination/fetched_count",
        "expected": 2
      },
      {
        "assertion_id": "returned-count",
        "step_id": "read_page_one",
        "kind": "equals",
        "pointer": "/pagination/returned_count",
        "expected": 2
      },
      {
        "assertion_id": "emitted-count",
        "step_id": "read_page_one",
        "kind": "equals",
        "pointer": "/pagination/emitted_count",
        "expected": 2
      },
      {
        "assertion_id": "effective-wire-limit",
        "step_id": "read_page_one",
        "kind": "equals",
        "pointer": "/pagination/effective_wire_limit",
        "expected": 2
      },
      {
        "assertion_id": "not-exhausted",
        "step_id": "read_page_one",
        "kind": "equals",
        "pointer": "/pagination/source_exhausted",
        "expected": false
      },
      {
        "assertion_id": "continuation-present",
        "step_id": "read_page_one",
        "kind": "contains",
        "pointer": "/pagination/continuation",
        "expected": {
          "presence": "value"
        }
      },
      {
        "assertion_id": "no-extra-record",
        "step_id": "read_page_one",
        "kind": "absent",
        "pointer": "/data/elements/2",
        "expected": {
          "presence": "absent"
        }
      }
    ],
    "cleanup": {
      "always": true,
      "owned_id_captures": [],
      "steps": []
    }
  },
  {
    "scenario_version": "pm.scenario/v1",
    "scenario_id": "github-read-next-page",
    "connector_id": "github",
    "lane": "direct_read",
    "operation_id": "issues/list-for-repo",
    "source_refs": [
      {
        "source_id": "github-rest-api-description",
        "pointer": "#/paths/~1repos~1{owner}~1{repo}~1issues/get"
      },
      {
        "source_id": "github-rest-api-description",
        "pointer": "#/paths/~1repos~1{owner}~1{repo}~1issues/get/responses/200/content/application~1json"
      }
    ],
    "requirements": [
      {
        "requirement_id": "service.public-path",
        "kind": "service",
        "value": "pm.client-api-worker.public-path"
      },
      {
        "requirement_id": "secret.pm-connection",
        "kind": "secret_reference",
        "value": "connection/acme-widgets-github-read"
      },
      {
        "requirement_id": "capability.http.execute",
        "kind": "capability",
        "value": "http.execute"
      },
      {
        "requirement_id": "capability.value.serialize",
        "kind": "capability",
        "value": "value.serialize"
      },
      {
        "requirement_id": "capability.effect.authorize",
        "kind": "capability",
        "value": "effect.authorize"
      },
      {
        "requirement_id": "capability.effect.limit",
        "kind": "capability",
        "value": "effect.limit"
      },
      {
        "requirement_id": "capability.http.paginate",
        "kind": "capability",
        "value": "http.paginate"
      },
      {
        "requirement_id": "foundation.http.execute",
        "kind": "foundation",
        "value": "FND-06@1.0.0"
      },
      {
        "requirement_id": "foundation.value.serialize",
        "kind": "foundation",
        "value": "FND-03@1.0.0"
      },
      {
        "requirement_id": "foundation.effect.authorize",
        "kind": "foundation",
        "value": "FND-05@2.0.0"
      },
      {
        "requirement_id": "foundation.effect.limit",
        "kind": "foundation",
        "value": "FND-10@2.0.0"
      },
      {
        "requirement_id": "foundation.http.paginate",
        "kind": "foundation",
        "value": "FND-08@1.0.0"
      },
      {
        "requirement_id": "fixture.github.issues.two-pages",
        "kind": "fixture",
        "value": "fixture.github.issues.two-pages"
      }
    ],
    "steps": [
      {
        "step_id": "read_page_one",
        "kind": "invoke",
        "depends_on": [],
        "action": "issues/list-for-repo",
        "input": {
          "path.owner": "acme",
          "path.repo": "widgets",
          "query.per-page": 2,
          "query.page": 1
        },
        "captures": []
      },
      {
        "step_id": "read_page_two",
        "kind": "invoke",
        "depends_on": [
          "read_page_one"
        ],
        "action": "issues/list-for-repo",
        "input": {
          "path.owner": "acme",
          "path.repo": "widgets",
          "query.per-page": 2,
          "query.page": 2
        },
        "captures": []
      }
    ],
    "assertions": [
      {
        "assertion_id": "exact-id",
        "step_id": "read_page_one",
        "kind": "equals",
        "pointer": "/data/elements/0/fields/id",
        "expected": {
          "presence": "value",
          "type": "integer",
          "exact": "9001",
          "precision": 4,
          "scale": 0
        }
      },
      {
        "assertion_id": "exact-number",
        "step_id": "read_page_one",
        "kind": "equals",
        "pointer": "/data/elements/0/fields/number",
        "expected": {
          "presence": "value",
          "type": "integer",
          "exact": "17",
          "precision": 2,
          "scale": 0
        }
      },
      {
        "assertion_id": "exact-repository",
        "step_id": "read_page_one",
        "kind": "equals",
        "pointer": "/data/elements/0/fields/repository_url",
        "expected": {
          "presence": "value",
          "type": "string",
          "text": "https://api.github.com/repos/acme/widgets"
        }
      },
      {
        "assertion_id": "page-one-count",
        "step_id": "read_page_one",
        "kind": "equals",
        "pointer": "/pagination/emitted_count",
        "expected": 2
      },
      {
        "assertion_id": "page-one-continuation",
        "step_id": "read_page_one",
        "kind": "contains",
        "pointer": "/pagination/continuation",
        "expected": {
          "presence": "value"
        }
      },
      {